"","snippet.title","stock_name","statistics.viewCount","statistics.likeCount","statistics.dislikeCount","statistics.favoriteCount","statistics.commentCount","snippet.publishedAt","snippet.channelTitle"
"166","TRUMP LOVES LORDSTOWN MOTORS STOCK? WORKHORSE STOCK UPDATE! WKHS STOCK","WKHS","19101","1971","24","0","399","2020-09-29T15:59:00Z","Jack Spencer Investing"
"167","UNDERVALUED INNOVATIVE SPAC?! DESKTOP METALS STOCK ANALYSIS TRNE STOCK","NA","15608","1259","8","0","303","2020-09-22T15:59:01Z","Jack Spencer Investing"
"168","USPS CONTRACT LEAK? WORKHORSE STOCK NEWS! BIG INSTITUTIONAL BUYING!","WKHS","63077","3792","90","0","683","2020-11-20T15:59:02Z","Jack Spencer Investing"
"169","USPS CONTRACT LEAK?! HUGE WORKHORSE STOCK NEWS AND MOVES!","WKHS","27128","1968","48","0","308","2021-01-08T14:59:01Z","Jack Spencer Investing"
"170","USPS CONTRACT WORTH $8 BILLION?! - HUGE WORKHORSE STOCK NEWS!","WKHS","46968","3908","48","0","761","2020-09-20T17:59:01Z","Jack Spencer Investing"
"171","VIRGIN GALACTIC STOCK HAS GONE PARABOLIC! SPCE STOCK NEWS!","NA","10058","591","8","0","257","2021-01-27T16:59:01Z","Jack Spencer Investing"
"172","VIRGIN GALACTIC STOCK NEWS! IS SPCE THE WORLD'S BEST GROWTH STOCK?","NA","14596","1134","18","0","223","2020-08-02T13:59:06Z","Jack Spencer Investing"
"173","VIRGIN GALACTIC STOCK PREDICTIONS! - WHEN WILL WE MAKE MONEY?","NA","13522","1047","21","0","242","2020-09-27T16:59:01Z","Jack Spencer Investing"
"174","VIRGIN GALACTIC STOCK UPDATE! SPCE STOCK - BUY OR SELL?!","NA","16542","1400","12","0","289","2020-08-23T16:59:21Z","Jack Spencer Investing"
"175","WARNING TO NIO STOCK INVESTORS - NIO CAN GO LOWER - NIO STOCK NEWS.","NIO","16226","1049","75","0","223","2020-11-15T15:59:01Z","Jack Spencer Investing"
"176","WARNING TO NIO STOCK INVESTORS. - NIO STOCK NEWS - NIO MANIPULATION.","NIO","48831","3051","148","0","900","2020-11-07T15:59:01Z","Jack Spencer Investing"
"177","WARREN BUFFETT IS BUYING ASSETS AGAIN! BUFFETT BUYS DOMINION ENERGY!","LAB","5654","371","7","0","70","2020-07-07T16:59:15Z","Jack Spencer Investing"
"178","WHAT IS GOING ON WITH WORKHORSE STOCK?! WKHS STOCK NEWS.","WKHS","29637","1815","131","0","754","2021-02-19T15:59:01Z","Jack Spencer Investing"
"179","WHY I MIGHT BUY NAT STOCK?! NAT STOCK ANALYSIS! - NAT SHORT SQUEEZE.","NAT","7676","457","5","0","188","2020-06-02T19:59:29Z","Jack Spencer Investing"
"180","WHY IS WORKHORSE STOCK CRASHING? WKHS STOCK PRICE PREDICTIONS.","WKHS","24786","1706","36","0","329","2021-01-01T14:59:01Z","Jack Spencer Investing"
"181","WHY WORKHORSE STOCK WILL WIN THE USPS CONTRACT. WKHS STOCK NEWS!","WKHS","32451","2851","28","0","819","2020-09-11T14:59:01Z","Jack Spencer Investing"
"182","WHY WORKHORSE WILL WIN THE USPS CONTRACT! - BUY WKHS STOCK NOW!?","WKHS","21804","1710","20","0","471","2020-07-17T15:59:09Z","Jack Spencer Investing"
"183","WHY YOU NEED TO BUY FACEBOOK STOCK NOW! - FACEBOOK STOCK ANALYSIS!","FB","5147","395","5","0","144","2020-05-23T16:59:25Z","Jack Spencer Investing"
"184","WHY YOU SHOULD NEVER SELL TESLA STOCK. TSLA STOCK ANALYSIS","TSLA","24584","1845","33","0","489","2020-09-08T15:59:02Z","Jack Spencer Investing"
"185","WILL AMERICAN AIRLINES STOCK GO BANKRUPT? - AAL STOCK ANALYSIS.","AAL","4519","239","11","0","105","2020-06-24T16:55:23Z","Jack Spencer Investing"
"186","WILL I BUY TESLA STOCK? - TESLA SOTCK ANALYSIS.","LAB","467","32","0","0","6","2020-03-31T18:00:35Z","Jack Spencer Investing"
"187","WILL THE USPS CONTRACT BE ANNOUNCED TUESDAY? WORKHORSE STOCK NEWS!","WKHS","24456","2261","29","0","393","2020-10-11T14:58:57Z","Jack Spencer Investing"
"188","WORKHORSE AND IKEA PARTNERSHIP CONFIRMED?! HUGE WORKHORSE STOCK NEWS!","WKHS","24365","2077","36","0","257","2020-12-28T18:59:01Z","Jack Spencer Investing"
"189","WORKHORSE COULD STILL WIN THE USPS CONTRACT? WKHS STOCK NEWS.","WKHS","15318","1089","123","0","326","2021-03-10T16:59:01Z","Jack Spencer Investing"
"190","WORKHORSE DIDN’T GET THE USPS CONTRACT.. TODAY. WKHS STOCK NEWS.","WKHS","44325","3426","94","0","885","2020-10-13T17:59:02Z","Jack Spencer Investing"
"191","WORKHORSE JUST CHANGED EVERYTHING.. - HUGE WORKHORSE STOCK NEWS!","WKHS","39108","3743","38","0","592","2020-10-12T14:59:39Z","Jack Spencer Investing"
"192","WORKHORSE STOCK ANALYSIS! - IS WORKHORSE STOCK STILL A BUY? WKHS STOCK","WKHS","15231","860","11","0","259","2020-07-04T14:59:23Z","Jack Spencer Investing"
"193","WORKHORSE STOCK COULD MAKE BILLIONS! - WKHS STOCK ANALYSIS! BUY WKHS NOW?","WKHS","18267","1156","16","0","371","2020-07-12T17:59:21Z","Jack Spencer Investing"
"194","WORKHORSE STOCK DIDN’T GET THE CONTRACT YET? - RANT! - WKHS STOCK NEWS","WKHS","25057","1850","51","0","669","2020-10-01T15:59:01Z","Jack Spencer Investing"
"195","WORKHORSE STOCK NEWS - WKHS Q3 EARNINGS - NEW WKHS SHORT?","WKHS","21014","1586","56","0","432","2020-10-28T16:59:01Z","Jack Spencer Investing"
"196","WORKHORSE STOCK NEWS! - 40,000 VEHICLE MINIMUM ORDER? WKHS STOCK!","WKHS","32680","2571","66","0","398","2020-10-24T14:59:00Z","Jack Spencer Investing"
"197","WORKHORSE STOCK NEWS! - ARK INVEST, HVIP - RIVIAN SUED BY TESLA?!","WKHS","27435","2888","32","0","445","2020-07-31T14:59:07Z","Jack Spencer Investing"
"198","WORKHORSE STOCK NEWS! - TEARING DOWN THE BEARS - WKHS STOCK ANALYSIS","WKHS","24946","1941","28","0","458","2020-09-27T13:59:03Z","Jack Spencer Investing"
"199","WORKHORSE STOCK NEWS! ARK INVEST BUYING HEAVY - INSIDER SELLING?","WKHS","19700","1584","29","0","340","2020-12-18T15:59:01Z","Jack Spencer Investing"
"200","WORKHORSE STOCK NEWS! ARK INVEST LOADING UP! LORDSTOWN MOTOR'S SPAC?!","WKHS","27197","2115","30","0","412","2020-07-24T14:59:15Z","Jack Spencer Investing"
"201","WORKHORSE STOCK NEWS! PRICE ACTION AND PRICE TARGETS! WKHS STOCK!","WKHS","22770","1449","46","0","263","2020-11-04T17:59:26Z","Jack Spencer Investing"
"202","WORKHORSE STOCK PRICE PREDICTION, 3-4 MONTHS. WKHS STOCK UPDATES.","WKHS","20854","1772","44","0","303","2020-12-11T18:59:01Z","Jack Spencer Investing"
"203","WORKHORSE STOCK PRICE PREDICTIONS - WKHS STOCK GROWTH CATALYSTS!","WKHS","30778","2503","84","0","599","2020-10-20T15:59:01Z","Jack Spencer Investing"
"204","WORKHORSE STOCK PRICE PREDICTIONS! - WKHS STOCK NEWS.","WKHS","25984","2319","41","0","351","2020-10-16T14:59:02Z","Jack Spencer Investing"
"205","WORKHORSE STOCK PRICE TARGET! WKHS STOCK UPDATE!","WKHS","23776","1682","36","0","358","2020-08-28T15:59:07Z","Jack Spencer Investing"
"206","WORKHORSE TO BECOME THE TESLA OF DELIVERY TRUCKS? WKHS STOCK NEWS!","WKHS","22925","1891","46","0","277","2020-12-22T18:59:01Z","Jack Spencer Investing"
"207","YOU NEED TO KNOW THIS ABOUT WORKHORSE STOCK. WKHS STOCK NEWS.","WKHS","18582","1476","12","0","231","2021-01-11T16:59:01Z","Jack Spencer Investing"
